Topic,Count,Name,Representation,Llama2,Representative_Docs
55,104,55_batteries_alkaline_energizer_duracell,"['batteries', 'alkaline', 'energizer', 'duracell', 'battery', 'alkaline batteries', 'lithium', 'coppertop', 'duracell coppertop', 'aa']","['Duracell Coppertop Alkaline Batteries', '', '', '', '', '', '', '', '', '']","[""duracell coppertop alkaline batteries this is a good product at a good price . duracell batteries are the way to go . they are very reliable , long lasting , and cheap . you ca n't get better batteries for cheaper . i have used duracell batteries for years and"", ""duracell coppertop alkaline batteries yes they are batteries . yes they work and a name brand . they are batteries . they work for anything needing aa 's ."", 'duracell coppertop alkaline batteries duracell 9 v alkaline batteries , 4 count , ( packaging may vary ) i have used duracell products over the years and have been and still pleased .']"
56,102,56_essie_polish_nail_nail polish,"['essie', 'polish', 'nail', 'nail polish', 'coats', 'color', 'zoya', 'opi', '06', 'coat']","['Nail polish reviews and recommendations', '', '', '', '', '', '', '', '', '']","[""zoya nail polish i like the zoya nail polish , in 34 raven 34 .. it needs 2 coats , which is normal for most nail polishes . it 's very black .. i 'm not sure its my favorite formula ever though . nothing is really wrong with it"", ""essie spring '06 collection this is my 2nd favorite nail polish color , the first is opi 's natasha boris . this one is great cause its super light , i would call it a ballerina pink . looks great with one coat or two ."", 'zoya nail polish i am thrilled to have found a nail polish with out formaldehyde and toulons . it is a great color for spring . i am happy with the product .']"
57,100,57_cosequin_nutramax_vet_capsules,"['cosequin', 'nutramax', 'vet', 'capsules', 'sprinkle', 'dogs', 'joint', 'tablets', 'supplement', 'cats']","['Cosequin supplement for cats and dogs', '', '', '', '', '', '', '', '', '']","['nutramax cosequin for cats 80 sprinkle capsules my older cat was starting to limp from a previous injury . i decided to try cosequin for him and it really helped his limping . he gets it every day now and seems to do well on it .', 'nutramax cosequin for cats 80 sprinkle capsules i have been using cosequin for a long time with our cats . we lost two who used it in 2004 and 2005 , but cosequin granted them a new lease on movement . where they would no longer play or jump ,', 'i got 2 for 1 when i bought the cosequin . nutramax cosequin for cats 80 sprinkle capsules']"
58,99,58_foundation_makeup_mineral_bare,"['foundation', 'makeup', 'mineral', 'bare', 'bareminerals', 'youngblood', 'bare minerals', 'bare escentuals', 'escentuals', 'coverage']","['Best Mineral Makeup for Sensitive Skin', '', '', '', '', '', '', '', '', '']","['youngblood loose mineral foundation this mineral makeup is , by far , the best on the market . the coverage is exceptional . the first time i came across it was at my hair salon . my young stylist used it , and she was living proof . her skin', 'youngblood loose mineral foundation this mineral makeup is , by far , the best on the market . the coverage is exceptional . the first time i came across it was at my hair salon . my young stylist used it , and she was living proof . her skin', 'youngblood loose mineral foundation this mineral makeup is , by far , the best on the market . the coverage is exceptional . the first time i came across it was at my hair salon . my young stylist used it , and she was living proof . her skin']"
59,98,59_days_weeks_minutes_afternoon,"['days', 'weeks', 'minutes', 'afternoon', 'mouth', 'month', 'months', 'week', 'day', 'times month']","['Veterinary medicine for guinea pigs', '', '', '', '', '', '', '', '', '']","[""in over 6 weeks . even if i have forgotten to put it on for a couple days , every time i go to put my fingers in my mouth , some kind of reverse pavlov 's dog effect happens and i just remember how nasty this stuff tastes and"", ""mouth feel like it was burning . it also made my mouth feel a lot cleaner for a lot longer time . if i used it right before bed , i did n't wake up with bad morning breath ."", ""weeks . i noticed my guinea pigs began to itch less and they 're fur began to grow back where patches were missing .. overall the medicine worked well and did the job . i would still say take your guinea pigs to a vet or a humane society that""]"
60,97,60_blocks_melissa doug_melissa_doug,"['blocks', 'melissa doug', 'melissa', 'doug', 'block', 'shapes', 'abc', 'unit blocks', 'blocks bought', 'sorting']","['Blocks and Shapes', '', '', '', '', '', '', '', '', '']","[""melissa doug deluxe jumbo cardboard blocks ( 40 pc ) i bought these blocks thinking they were going to be like the one 's i had when i was a kid . no such luck . only 8 of the 40 blocks are what i 'd even classify as jumbo"", 'edushape mini edu soft and flexible blocks , set of 52 the blocks are pretty good although the smaller sized blocks will not stay on the larger sized blocks as well as they should . the bag is junk , way too small for putting all the blocks in and', 'melissa doug deluxe 50 piece wooden abc 123 blocks set these melissa and doug blocks were one of the most popular wooden alphabet blocks on amazon , so i purchased them expecting a standard set of alphabet blocks . the problem ? the letters and pictures do not match up']"
61,96,61_dollhouse_furniture_castle_princess,"['dollhouse', 'furniture', 'castle', 'princess', 'doll house', 'loving family', 'house', 'cottage', 'doll', 'loving']","['Dollhouse Furniture and Accessories', '', '', '', '', '', '', '', '', '']","['dollhouse furniture the dollhouse furniture collection was a great bargain . so much furniture for one low price ! my 6 year old grandaughter loves the furniture and everyday plays with it and her barbie dolls . her brother , age 4 , loves to play with her and the', 'fisher price loving family twin time dollhouse my daughter plays with this dollhouse all the time . we have all the furniture and a couple of the cars . but please do not pay 250 for it , cruise by toys r us and you can still find this version', 'loving family sweet sounds dollhouse even the greatest imagination can get bored with no physical props . how can you sell a dollhouse with little to no furniture in it or available to purchase ! this is a disgrace .. my daughters in law bought 2 fisher price houses for']"
62,94,62_bars_bar_ounce bars_bars pack,"['bars', 'bar', 'ounce bars', 'bars pack', 'clif', 'pack 15', 'energy', 'energy bar', 'clif bar', 'balance']","['Nutritional Bars: Balance Bar Review', '', '', '', '', '', '', '', '', '']","[""balance bar nutrition energy bar , 1 . 76 ounce bars ( pack of 15 ) i loved the flavor of the bars ! ! ! i really did n't expect them to be as good as they are ! ! ! i have had other nutritional bars that tasted"", 'balance bar nutrition energy bar , 1 . 76 ounce bars ( pack of 15 ) the "" yummy bars "" are balance bars sold on amazon . i purchased peanut butter bars which are yummy indeed . i eat one every day ! ! so good for the tummy', ""balance bar nutrition energy bar , 1 . 76 ounce bars ( pack of 15 ) ca n't usually stand protein bars . too thick , hard to chew , and soy flavored . crave these bars ! they are n't like homemade , but they are as good as""]"
63,93,63_cars_hot wheels_wheels_truck,"['cars', 'hot wheels', 'wheels', 'truck', 'hot', 'car', 'trucks', 'son', 'garbage truck', 'garbage']","['Hot Wheels toy reviews', '', '', '', '', '', '', '', '', '']","['hot wheels radar gun i son likes the hot wheels radar gun . it is easy to use and it really works . i am not sure how accurate it is , but the kids have good time seeing how fast other cars are going when we are on the', 'hot wheels this is a review from my seven year old son , who loves hot wheels and has been collecting and playing with them for 4 years . he says', 'hot wheels 10 car pack ( styles may vary ) always love the variety of hot wheels cars ! my son cannot get enough of these simple toys . and the price of them is always reasonable .']"
64,91,64_glaze_china glaze_lacquer_china,"['glaze', 'china glaze', 'lacquer', 'china', 'nail lacquer', 'nail', 'polish', 'color', 'glitter', 'nail polish']","['Nail polish - China Glaze', '', '', '', '', '', '', '', '', '']","['china glaze nail lacquer with hardeners china glaze is by far my favorite brand when it comes to nail polish and this color was no exception . now i was a little skeptical when i first came across this color due to some of the reviews but in the end', 'china glaze nail lacquer with hardeners i never thought i would love this color on me but surprisingly i did . i top it with china glaze 34 fairy dust 34 .', 'china glaze nail lacquer with hardeners matches both reds and oranges . very sassy on toes . china glaze is a long lasting and durable polish . hope they will bring the color back !']"
65,90,65_star wars_wars_star_figure,"['star wars', 'wars', 'star', 'figure', 'yoda', 'darth', 'jedi', 'droid', 'vader', 'gear']","['Star Wars collectibles', '', '', '', '', '', '', '', '', '']","['star wars e3 anakin skywalker bf67 this is my favorite star wars figure of all time . i love the detail on the figure . i love putting it on my darth vader operating table . the great thing is the legs come off and it has interchangable heads and', 'star wars arc 170 starfighter this is the largest star wars vehicle i own ( before i receive my at at ) i have a a wing , 2 slave 1s , a tie bomber , and a jedi star fighter and this makes them look small . i am', ""star wars power of the force ben kenobi red card action figure with lightsaber and removable cloak i 'm glad the old star wars characters are still available . my grandson has just been introduced to the old star wars movies and has become a number 1 fan !""]"
66,90,66_cat_cat toy_cats_dancer,"['cat', 'cat toy', 'cats', 'dancer', 'mouse', 'da bird', 'catnip', 'toy', 'feathers', 'da']","['Cat Toys and Accessories', '', '', '', '', '', '', '', '', '']","[""the da bird value pack ( includes 1 da bird original single 3 foot pole cat toy 2 replacement feathers ) i have used da bird with several cats , including my three kitties , and my daughter 's five cats . from small lithe active kitties to slow chubby"", ""the da bird value pack ( includes 1 da bird original single 3 foot pole cat toy 2 replacement feathers ) this toy is one of the best items i have ever bought for my cats . they 're pretty finicky and they have n't taken to other toys or"", 'cat dancer 101 cat dancer interactive cat toy my cat really loves this cat dancer . i lost the first one we had and have never been able to find one since . thankyou .']"
67,89,67_swing_cradle_fisher price_fisher,"['swing', 'cradle', 'fisher price', 'fisher', 'swings', 'papasan', 'price ocean', 'ocean wonders', 'ocean', 'wonders aquarium']","['Parenting products: Fisher Price swings', '', '', '', '', '', '', '', '', '']","[""fisher price cradle 'n swing i absolutely love this swing . my son loves to be held in a cradle position , like his carseat , and this swing . he prefers being held , but that is n't always an option , and this swing is perfect . he"", ""fisher price cradle 'n swing i ordered this swing after my original papasan swing , in the nature 's touch pattern ( model m5584 ) , lost its swing motor . a new motor was more than half of the cost of this swing , and the new motor would"", 'before it stopped swinging it was a great swing . i love that it can cradle him or swing him .']"
68,88,68_braun_shaver_braun series_series,"['braun', 'shaver', 'braun series', 'series', 'shave', 'men shaver', 'razor', 'syncro', 'electric', '8985']","['Best Braun Electric Shavers', '', '', '', '', '', '', '', '', '']","[""braun series 1 190 men 's shaver this is really the series 1 shaver ( 190 model ) by braun it can be had for under 50 bucks i had a series 5 shaver for two months , and the series 1 was actually a better shaver for me ("", 'braun series 7 760cc shaver i was using a less expensive braun electric shaver for the past 4 years , then i read a review about the braun series 7 760cc , which lead me to buy one and i am not disappointed . as stated in the review it', ""braun series 7 790cc pulsonic shaver braun series 7 790cc pulsonic shaveri was reluctant to spend the money they wanted for this shaver , but it was worth it . i 'm thouroughly satisfied with this one . it cuts better than the remington 's that i 've been using""]"
69,87,69_heating_heating pad_pad_moist,"['heating', 'heating pad', 'pad', 'moist', 'heat', 'sunbeam', 'moist heat', 'cold', 'pads', 'elasto']","['Sunbeam Heating Pads: Quality and Durability Concerns', '', '', '', '', '', '', '', '', '']","[""sunbeam health at home standard moist heating pad with 3 heat settings , sky blue i 'm replacing a heating pad that 's at least a decade old that got nice and hot . this one is lukewarm ! on high ( i preheated it for a half hour to"", ""sunbeam health at home king size soft touch heating pad with 4 heat settings and 2 hour auto off , blue i love this heating pad . it 's the best i 've ever had , and i will buy a second one for my place at the couch ."", ""sunbeam health at home standard moist heating pad with 3 heat settings , sky blue this heating pad worked good as far as heat , but only lasted for about 2 years . when it was working , the cover would n't stay on , then it started working intermittently""]"
70,87,70_color_purple_green_blue,"['color', 'purple', 'green', 'blue', 'gray', 'colors', 'neutral', 'picture', 'blues', 'looking']","['Color Descriptions and Neutral Shades', '', '', '', '', '', '', '', '', '']","['color online to be sure , and although it looks like it has a greenish hue on most of the images , it does not . if you imagine mixing a light blue color with something to add a slight hint of a greyishness to it , then you add', "", there 's large green light blue sparkles surrounded by tiny dark blue pigment and tiny blue sparkles . i got so many compliments wearing it ! it also have the colors of an abalone shell , the purples and greens and blues are to die for ! it is"", '. color of mat , mine was called grey and red . this is referring to the color of the trim and the exterior material , not the interior pattern . so , if you order gray green , it means the exterior is gray and the trim is green']"
71,87,71_slim jim_jim_snack_slim,"['slim jim', 'jim', 'snack', 'slim', 'sticks', 'taste', 'expiration', 'snack sticks', 'healthier', 'date']","['Slim Jim Snack Sticks: Taste, Expiration, and Healthier Options', '', '', '', '', '', '', '', '', '']","['slim jim snack sticks this is a good product and is very tasty , as long as the box has not been tampered with . some people tend to open the box and eat a few while in transit i suspect . they are just that good a snack .', 'slim jim snack sticks if you are a fan of slim jim , buying this package is perfect . each slim jim is packed in a small , snack sized plastic wrap and the price is really great for the 100 slim jims this package offers . with that said', 'slim jim snack sticks i receive today my order of slim jim , but i feel bad because i did not receive what i order 1 i order the slim jim perfect on the go snack ( 100 ) counts and a weight of 3 pounds , the wording perfect']"
72,86,72_scent_smell_flowery_scents,"['scent', 'smell', 'flowery', 'scents', 'fragrance', 'floral', 'musk', 'subtle', 'men', 'perfume']","['Perfume reviews and scent descriptions', '', '', '', '', '', '', '', '', '']","[""on my skin ! it 's a wonderful scent with a hint of floral and a hint of sexy , underscored by a slight muskiness that is n't overwhelming at all . the scent is feminine without being overly flowery , and i would highly recommend it to anyone !"", 'could get annoying if you \'re not a fan of the scent . as far as i \'m aware , no one else could smell it on me , either , which is good , because i \'m not of the school of "" well , i like this scent', 'i smelled it , it smelled like a guys scent . its disappointing . but when i smelled it twice , it changes my judgement to the perfume . its actually calming , yet awakening . for me , its not a girly flowery scent , its like a lady']"
73,85,73_treats_dog treats_dog_treat,"['treats', 'dog treats', 'dog', 'treat', 'zuke', 'biscuits', 'dogs', 'training', 'liver', 'freeze dried']","['Dog Treats and Training', '', '', '', '', '', '', '', '', '']","['pro treat beef liver , freeze dried dog treats we have been using these dog treats for a long time . the dogs love them a lot ! you cannot go wrong with these because they are all natural . the only thing that i would say is a little', ""zuke 's mini naturals dog treats these are excellent treats for training . they are the perfect size and you can put them in your pocket without worrying about your pocket smelling like dog treats or leaving crumbs behind . my dog likes all three flavors . the treats do"", 'blue dog bakery natural low fat dog treats , assorted flavors , 20 ounce boxes ( pack of 6 ) these dog treats are wonderful . i have two shelties and my daughter has two shiba inus . all four just love these cookies . all i have to say']"
74,81,74_feeder_pet feeder_food_automatic pet,"['feeder', 'pet feeder', 'food', 'automatic pet', 'pet', 'dish', 'timer', 'automatic', 'vittles vault', 'vittles']","['Automatic Pet Feeders', '', '', '', '', '', '', '', '', '']","[""petmate lebistro portion control automatic pet feeder , black , 4.2 pounds i purchased this to keep my cat from waking me up at 5 00 am wanting to be fed . it is somewhat difficult to program . the instructions were n't that helpful . once it was program"", ""petmate lebistro portion control automatic pet feeder , black , 4.2 pounds nicely designed , works well ... setup is a little tedious but you 'll get it done after several tries"", ""petmate lebistro portion control automatic pet feeder , black , 4.2 pounds i 've owned the feeder for a year now and despite the awkward programming , it 's a great product , very reliable . i have no fear of leaving my cats for the weekend with it .""]"
75,80,75_amazon_amazon com_com_buy,"['amazon', 'amazon com', 'com', 'buy', 'store', 'buy store', 'shops', 'hawaii', 'address', 'order']","['Online shopping at Amazon', '', '', '', '', '', '', '', '', '']","[""to buy . only amazon . com had this excellent product available . could n't find it in my area ."", ""amazon . com i love this invention ! ! i so wanted to stop every single person i saw hauling lugging around a car seat about this product ! it 's a smooth ride , pulls easily , my little man loved it ... it was easy to push forward"", 'so thankful that amazon . com had exactly the items i was looking for . my first experience with amazon . com was very pleasant , and i will utilize amazon . com again in the future .']"
76,79,76_toothpaste_whitening_teeth_mouthwash,"['toothpaste', 'whitening', 'teeth', 'mouthwash', 'enamel', 'mint', 'dental', 'fluoride', 'listerine', 'crest']","['Toothpaste and Whitening Options', '', '', '', '', '', '', '', '', '']","['this toothpaste helps save your enamel making your teeth whiter without being too rough on them .', ""squigle enamel saver toothpaste this toothpaste does a good job cleaning and whitening my teeth without giving me any tooth pain . i 've read that normal toothpastes can actually make your teeth more yellow by scraping off the enamel and revealing the yellow colored dentine beneath the enamel ."", ""plus white xtra whitening every day whitening toothpaste with tartar control , cool mint , 3.5 oz ( 100 g ) , ( pack of 6 ) this is my favorite whitening toothpaste ( i 've tried so many ) what a great deal this was !""]"
77,79,77_soup_pack 12_ounce_cans pack,"['soup', 'pack 12', 'ounce', 'cans pack', 'ounce cans', '12', 'cans', 'noodle', 'pack', 'beans']","['Soup Pack Essentials', '', '', '', '', '', '', '', '', '']","['wolfgang puck organic french onion soup , 14 . 5 ounce cans ( pack of 12 ) i use this as the base for a fabulous oven baked delight . i never just use the soup alone ... i toast up an english muffin or some nice crusty bread and', ""amy 's organic fire roasted southwest vegetable soup , 14 . 3 ounce cans ( pack of 12 ) we boil some tri color vegetable rotini add this soup to the drained pasta and add a large can of pre cooked ckicken . makes a tasty casserole . add cheese"", ""wolfgang puck organic creamy tomato soup , 14 . 5 ounce cans ( pack of 12 ) my favorite soup and its' not sold in any stores where i live . so buying it on amazon is the best !""]"
78,79,78_door_petsafe_flap_pet door,"['door', 'petsafe', 'flap', 'pet door', 'cat door', 'pet', 'install', 'wall', 'doors', 'doorbell']","['Pet door installation and repair', '', '', '', '', '', '', '', '', '']","['petsafe pet door replacement flap this is the correct replacement flap for the petsafe large dog door . worked fine and the door is like new .', 'removed the back door to install the dog door into it , and then replaced the back door on its hinges . ) i wish i had bought this door four years ago back when my german shepherd was a little fuzzball . update', 'the dog out , this is not your door .']"
79,79,79_waterpik_flosser_waterpik ultra_floss,"['waterpik', 'flosser', 'waterpik ultra', 'floss', 'ultra', 'water', 'flossing', 'dental', 'teeth', 'woven']","['Waterpik Ultra Water Flosser - A Game Changer for Healthy Teeth', '', '', '', '', '', '', '', '', '']","['waterpik ultra water flosser this product is absolutely the best ! i love all the features and the variable water pressures . great for the teeth and gums ! waterpik ultra dental water jet', 'waterpik ultra water flosser i purchase a ultra water flosser and and i am so happy i recommend to everybody that want to keep a healthy teeth floss never be so easy', 'waterpik ultra water flosser i have never used a waterpik before and wonder why not this is a great product ! since i am not coordinated enough to do a good job with regular floss , this is perfect for me . i seriously am getting addicted to using this']"
80,78,80_bag_diaper bag_diaper_skip hop,"['bag', 'diaper bag', 'diaper', 'skip hop', 'hop', 'dude', 'skip', 'pocket', 'weekender', 'canvas']","['Diaper Bag Options', '', '', '', '', '', '', '', '', '']","[""diaper dude diaper bag my husband did n't like using my diaper bag , so this is a great bag with a lot of pockets to carry all the essentials . now when he 's out by himself with the baby he 's got a great looking bag that is"", ""navy eddie bauer weekender diaper bag i 'm a mom of a 7 month old and am looking for a different diaper bag . i find this bag a bit burdensome . the feature of the fold out changing pad makes the bag bulky , and my growing daughter no"", 'diaper dude diaper bag i bought this as mine and my husbands diaper bag . i wanted to get something that he would be ok with carrying around ... but as it turned out he rarely carried it since we mostly went places while he was working . i thought']"
81,77,81_wipes_wipe_baby wipes_warmer,"['wipes', 'wipe', 'baby wipes', 'warmer', 'seventh generation', 'seventh', 'wipes warmer', 'generation', 'clear baby', 'free clear']","['Parenting products: Seventh Generation baby wipes', '', '', '', '', '', '', '', '', '']","[""seventh generation free clear baby wipes these wipes do have kind of a bad smell to them even though they are unscented . my husband ca n't stand it but i can deal with it . but , the wipes are a good size and they are nice and soft"", ""seventh generation free clear baby wipes i love these wipes over the usual name brand wipes . my son 's rashes have cleared up and he seems less sensitive when we use these wipes . great product , thanks !"", ""the wipes . it is so hard to find the perfect non toxic wipe . i 've tried tushies wipes . i like their ingredients but the wipes themselves are a little rough . these seventh generation wipes are much softer on my baby 's bottom . one other thing""]"
82,76,82_sound_marpac_ds_speed,"['sound', 'marpac', 'ds', 'speed', 'dual', 'noise', 'sleepmate', 'conditioner', 'white noise', 'fan']","['Marpac DS Dual Speed Sound Conditioner - White Noise Solution', '', '', '', '', '', '', '', '', '']","['marpac dohm ds dual speed sound conditioner i bought two of these , one as a gift and one for my home , when they were delivered to my office , i plugged one in to try it out . after 6 months i have never taken it home !', ""marpac dohm ds dual speed sound conditioner the marpac sleepmate really helps me sleep when there 's tv chatter coming through the bedroom wall from my neighbors . it hums away at a steady pitch and volume that i chose . it emits a soothing sound that actually lulls me"", 'marpac dohm ds dual speed sound conditioner great product . get the 2 speed since you can adjust the white noise when necessary . it may seem a pit pricey , but worth every penny .']"
