Topic,Count,Name,Representation,Llama2,Representative_Docs
110,59,110_ounce bottles_detergent_bottles_bottles pack,"['ounce bottles', 'detergent', 'bottles', 'bottles pack', 'dishwasher', 'cleaner', 'liquid', 'ounce', 'bottles case', 'pack']","['Eco-friendly household cleaning products', '', '', '', '', '', '', '', '', '']","[""mrs . meyer 's clean day automatic dishwashing liquid , lemon verbena , 48 ounce bottles ( case of 6 ) i love this product . cleans well and makes the house smell great without leaving a scent on the dishes . plus it requires half the amount of detergent"", 'seventh generation liquid dish detergent , free clear , 48 ounce bottles ( case of 6 ) great product . enviromentally safe ( or at least the company claims so ) . works just as any other dishwasher . cheap .', ""mrs . meyer 's clean day liquid hand soap , 12 . 5 ounce bottles ( case of 6 ) i enjoy using mrs . meyer 's products , but i especially like anything with the gardenia scent , so it was a treat to find the hand soap in""]"
111,59,111_pads_pad_wee_puppy,"['pads', 'pad', 'wee', 'puppy', 'training', 'training pads', 'iris', 'pee', 'wee wee', 'puppy dog']","['Puppy Training Pads', '', '', '', '', '', '', '', '', '']","[""iris neat 'n dry floor protection and training pads for puppies and dogs i purchased this puppy pad product for my two small puppies i am house training . both dogs are under 5 lbs . i have found these pads to hold up for about 12 hours , when"", 'wee wee and housebreaking training pads , 23x36 these pads are not absorbent . i have an older bichon not a large dog . in the past , i have used the 4 paws wee wee pads , and they work very well . i purchased these "" wee wee', 'iris puppy and dog training pad holder this protection tray for pet training pads keeps your puppy from playing with the edges of the pads . my puppy took to it from day one and uses it for now until i am ready to transition her to the back yard']"
112,59,112_seat_straps_car_car seat,"['seat', 'straps', 'car', 'car seat', 'headrest', 'carseat', 'head', 'belt', 'buckle', 'tighten']","['Car Seat Installation and Safety', '', '', '', '', '', '', '', '', '']","['and no , the shoulder straps were not lose ... he was snug in his seat . the only reason we moved him into the boulevard at 8 months was because of this ... otherwise he still fit nicely in this seat still . otherwise ... this seat would be', 'that the seat belt goes through to help tighten and hold the car seat in place better . i always had a hard time installing the baby seat and keeping it in place . it always seemed to move more than an inch side to side . this seat was', ""because i have rear headrests and she does n't . to secure it in her car we tilt the seat forward ( such as to gain trunk access ) and put the straps behind the corner of the seat then set it back in place . the seat cover has""]"
113,58,113_jumperoo_jumper_bouncer_price rainforest,"['jumperoo', 'jumper', 'bouncer', 'price rainforest', 'rainforest', 'fisher price', 'fisher', 'jumping', 'price', 'bumper']","['Parenting Product Reviews: Fisher Price Rainforest Jumperoo', '', '', '', '', '', '', '', '', '']","['fisher price rainforest jumperoo my 8 month old absolutely loves this jumper . his face lights up every time i put him in it . i paid 80 for it , but it has been worth every penny spent . he enjoys the jumping and playing with the attached toys', 'fisher price rainforest jumperoo my son was colicky as an infant and cried most of the time . at four months old , we put him into this jumper ( the recommended age is 6 months ) . he instantly loved the jumper , and was able to use it', 'fisher price rainforest jumperoo this jumperoo is execellent . got it for my 5 month old and he loves it . love to watch him jump so cute . )']"
114,58,114_thermometer_temperature_ear_accurate,"['thermometer', 'temperature', 'ear', 'accurate', 'probe', 'digital', 'reading', 'vicks', 'rectal', 'readings']","['Accuracy of different thermometers', '', '', '', '', '', '', '', '', '']","['mabis healthcare instant ear thermometer , white the thermometer just did not seem to be very accurate and inconsistent . i used this thermometer about 15 20 times . i tested my son , 7 months , my wife and myself . i cleaned the tip each time and each', ""safety 1st hospital 's choice accu touch forehead thermometer i was shocked when i read the negative comments about this thermometer . we selected this as a replacement for our ear thermometer on the recommendation of our pediatrian . apparently , if you do n't angle the ear thermometer just"", 'vicks baby rectal thermometer i own this thermometer , the braun ear thermometer and a safety first thermometer . this one is by far the best . it is the perfect size and fit in your hand , and there is like no chance of inserting it too far .']"
115,57,115_chocolate_cocoa_hot chocolate_hot cocoa,"['chocolate', 'cocoa', 'hot chocolate', 'hot cocoa', 'hot', 'ghirardelli', 'taste', 'milk chocolate', 'packets', 'stephen gourmet']","['Hot Chocolate Reviews', '', '', '', '', '', '', '', '', '']","[""stephen 's gourmet hot cocoa this really is the best hot chocolate i have ever tried ! and at this price , a terrific deal . it was delivered fast and as described . a"", 'ghirardelli chocolate premium hot cocoa mix , double chocolate , 16 oz my wedding was in october in michigan , chilly so i served this to warm our guests up . it was a hit , so yummy !', ""ghirardelli chocolate premium hot cocoa mix , double chocolate , 16 ounce tins ( pack of 4 ) i 've bought ghirardelli hot chocolate before , but it was a different type . the ghirardelli double chocolate premium hot cocoa mix does n't mix well with hot milk , and""]"
116,57,116_shipping_delivery_shipment_free shipping,"['shipping', 'delivery', 'shipment', 'free shipping', 'amazon', 'shipped', 'free', 'grips', 'order', 'com']","['Amazon Shipping and Delivery Issues', '', '', '', '', '', '', '', '', '']","[""window had past and we still had n't received the product , my daughter was very disappointed i had no way of knowing when the item would arrive . luckily , the item finally arrived 2 days later than the delivery window b c i was about to cancel my"", 'have found . i can get it in bulk with free shipping ! gotta love free shipping . as always with amazon . com , fast delivery .', 'good grips sure grips button hook good grips sure grips button hookwhy do these companies feel they can get away with high shipping charges . why am i being charged 6 . 49 to ship a 11 . 99 item more than half the cost of the item . it']"
117,56,117_carrier_baby carrier_wrap_baby,"['carrier', 'baby carrier', 'wrap', 'baby', 'babybjorn', 'snugli', 'moby', 'bjorn', 'moby wrap', 'evenflo snugli']","['Baby Carriers and Wraps', '', '', '', '', '', '', '', '', '']","['babybjorn baby carrier original this is a very good carrier . i recommend the mesh one with back support if you have the extra . i also recommend looking at the ergo ( but kid has to sit facing you . i also recommend looking at the cybex . we', 'moby wrap original 100 cotton solid baby carrier i am getting ready to use my moby with baby 2 and am soo looking forward to it . this was one of my favorite baby carriers when my son was a newborn . i bought it when he was around 3', 'moby wrap original 100 cotton solid baby carrier not as difficult as i thought it would be to wrap . baby girl is snug and feels secure against my body . i like it much better than sling type carriers .']"
118,56,118_food_dog food_dry dog_dog,"['food', 'dog food', 'dry dog', 'dog', 'natural balance', 'chicken', 'dogs', 'bag', 'wellness', 'dry']","['Dog Food Options', '', '', '', '', '', '', '', '', '']","[""wellness super5mix dry dog food i 've been buying wellness lamb dry dog food from this company via amazon . com for the past few years and have nothing but good things to say about the quality of both , the product and the service , competitive pricing and fast"", 'pet guard chicken lifespan premium dry dog food ( 1x18lb ) my dogs have been eating this food for several years now , along with the canned . each time i am urged to try a different holistic food , one of my 3 dogs has some sort of issue', 'natural balance organic formula dry dog food , 25 pound bag i am so happy to finally be done with trying to find a dog food that i feel good about feeding my dogs . i have a miniature schnauzer which of course has schnauzer bumps and a wire fox']"
119,55,119_cruisers_pampers cruisers_pampers_cruisers diapers,"['cruisers', 'pampers cruisers', 'pampers', 'cruisers diapers', 'diapers', 'huggies', 'swaddlers', 'diaper', 'plus pack', 'leak']","['Parenting: Diaper Choices - Pampers Cruisers vs Huggies', '', '', '', '', '', '', '', '', '']","[""pampers cruisers diapers we started with swaddlers and went into cruisers . never had a leak problem . ca n't say the same for huggies ."", ""pampers cruisers diapers we started with swaddlers and went into cruisers . never had a leak problem . ca n't say the same for huggies ."", 'pampers cruisers diapers these are hte best diapers . we went from swaddlers to cruisers . we tried the huggies but the mest and stretch of the pampers is just so much better . i really believe he is comfortable ! ! ! love pampers cruisers and swaddlers . pampers']"
120,54,120_fisher price_fisher_laugh learn_laugh,"['fisher price', 'fisher', 'laugh learn', 'laugh', 'price laugh', 'roll', 'learn learning', 'gumballs', 'table', 'ferris']","['Fisher Price Laugh & Learn Toys', '', '', '', '', '', '', '', '', '']","['fisher price laugh learn learning table my sons father purchased this toy as a xmas gift . at the time , my son was 9 months old . as i took it out the box he immediately wanted to play . this product is very easy to assemble ( you', 'fisher price laugh learn learning table our daughter got this gift for christmas when she was 9 months old . it was just at the time when she was good at pulling herself up . she has played with it non stop for the past 2 months . she loves', 'fisher price laugh learn learning table my daughter loves it . the table helps her to stand up and she bounces to the music .']"
121,54,121_walker_wheelchair_transport_cane,"['walker', 'wheelchair', 'transport', 'cane', 'wheels', 'medline', 'folding', 'chair', 'lightweight', 'rolling']","['Mobility Aids and Accessories', '', '', '', '', '', '', '', '', '']","['deluxe new asm ultralight paddle folding rolling walker 2x3 "" wheels adjustable height heavy duty indoor outdoor 300lb . capacity although this walker is sturdy , lightweight , and inexpensive , the front wheels are not in alignment . that causes the walker to be very noisy when in use', ""4 wheel rolling walker with shopping basket , padded seat burgundy color my girlfriend 's mom was having trouble with her original fold up walker . it only had two wheels , no seat , no brakes and was basically just a bare aluminum frame . she was a bit"", 'light 14 . 8 lbs medline freedom transport wheelchair 300 lb cap chair with back pocket i recently purchased this transport chair for my 83 year old mother . we already had a wheelchair rented through her medicare but it was 40 pounds , way too heavy for me to']"
122,54,122_12_100_box 100_packages,"['12', '100', 'box 100', 'packages', 'ordered', 'boxes', 'raisins', '88', 'box', '59']","['Product reviews and prices', '', '', '', '', '', '', '', '', '']","[""i gave the harold 's kitchen nylon pot scrapers 4 stars instead of 5 only because they seem a tad thinner ( especially the edges ) than some older nearly identical ones that were made in hong kong rather than taiwan . however , i ca n't find the old"", ""amazin' raisin orange flavored raisins , 6 count boxes ( pack of 12 ) i just received my raisins . they were packaged very nicely and i already knew i would like them . however , i was very disappointed to find that the entire 12 packages had an expiration"", ""cabinet . the cough went away within one hour and lasted just over 12 hours . the price was a bit much but considering how much i was paying for items that did n't work it is well worth every penny . i have purchased well over 100 items on""]"
123,53,123_cup_sippy_spout_sippy cup,"['cup', 'sippy', 'spout', 'sippy cup', 'leak', 'sippy cups', 'cups', 'proof', 'leaks', 'spill']","['Sippy Cups and Leaks', '', '', '', '', '', '', '', '', '']","['foogo by thermos leak proof ss 7 oz sippy cup with handle in blue did i misplace a piece to this cup or something ? it leaks all over . my 18 month old son loves turning it upside down and it literally pours out of the spout ... like', 'thermos foogo leak proof ss 7 ounce sippy cup with handles , pink , 6 months update so after using this cup for 3 weeks now , i have to admit that it leaks sometimes ! when first reassembled after washing , the cup does not leak ... even when', ""gerber soft spout two handle spill proof cup 2 pk we tried this cup when my daughter was 9 months old . she just could n't master drinking from this sippy cup or any other . we finally used the nubi cup for a month and now she is 13""]"
124,52,124_straightener_hair_straight_curls,"['straightener', 'hair', 'straight', 'curls', 'wavy', 'straighten', 'waves', 'bangs', 'hair straight', 'wavy hair']","['Hair Straightening and Styling', '', '', '', '', '', '', '', '', '']","['ogilvie conditioning hair straightener i have wavey to lightly curly hair . i straightened only my bangs with the product because basically i like my curls , just not on my bangs , where they have always bothered me , especially in the summer when swimming or exercising in humid', 'i go over and re curl my hair with this straightener and the curls come out perfect every time ! ! i am now a 20 year old woman and i have been using this straightener since i was 14 ! ! this straightener is the only one that would', 'keep my hair straight thru the whole day long ! ! other straighteners would allow my hair to frizz up and start to curl about 3 hours into my day , but this straightener will keep my hair straight , even after a whole day after straightening , plus a']"
125,51,125_msm_glucosamine_joint_ok ok,"['msm', 'glucosamine', 'joint', 'ok ok', 'arthritis', 'pain', 'mg', 'schiff', 'ok', 'joints']","['Natural joint supplements', '', '', '', '', '', '', '', '', '']","['source naturals vegetarian glucosamine 750mg i was so excited to find glucosamine without crushed shellfish . i was having constant arthritis pain in my right hand until i was able to find this product . the doctor prescribed glucosamine several years ago but i kept getting sick and finally discovered', 'now foods glucosamine chondroitin with msm i am a 63 year old female . i have bad arthritis in both knees . after one month of taking this product , i can tell a difference in the amount of pain so much that i will continue to buy this product', 'now foods msm 1500mg i have been taking now msm in 1500 mg tablets for about 3 months now and no longer have a need for ibuprofin to control joint pain . one you have this built up in your system , 3000 to 4500 mg per day seems to']"
126,51,126_plane_fly_air hogs_hogs,"['plane', 'fly', 'air hogs', 'hogs', 'kite', 'planes', 'air', 'airplane', 'helicopter', 'heli']","['Toy aircraft', '', '', '', '', '', '', '', '', '']","['air hogs havoc heli colors may vary this little helicopter is well worth the money . i was very skeptical that it would work for more than 2 flights and do anything other than go up and spin in place , but i was wrong . it can take a', 'air hogs havoc heli colors may vary this helicopter is a great little toy for the curious beginner . on my first use i was impressed with this choppers abilities for the price i got it for and my nearly five year old daughter absolutly loves to watch me fly', 'air hogs i recently purchased one of these planes for my son . firstly the cost of the plane nearly doubled when we included the cost of the batteries . secondly the plane is supposed to fly on "" auto pilot "" for the first five seconds to prevent ""']"
127,51,127_furminator_deshedding_deshedding tool_furminator deshedding,"['furminator', 'deshedding', 'deshedding tool', 'furminator deshedding', 'tool', 'shedding', 'sheds', 'fur', 'coat', 'tool does']","['Deshedding tools for dogs', '', '', '', '', '', '', '', '', '']","[""furminator deshedding tool this is the best deshedding tool . it 's easy , removes lots of hair and undercoat . i am very pleased with it . if you have small dog then small furminator would be ok . i have two labradors retrievers so i needed the biggest"", 'furminator deshedding tool the furminator works well . i have a huskey and he has a heavy coat and it does help some with cutting down on the shedding by keeping him brushed good', ""furminator deshedding tool deshedding tool blue , smalldeshedding tool blue , smallthe deshedding tool does take off more of my dog 's undercoat that i can get off with her regular brush , but not as much as i expected . this dog has a very thick coat and i""]"
128,51,128_lip_lip stuff_lipbalm_stuff tube,"['lip', 'lip stuff', 'lipbalm', 'stuff tube', '600 lipbalm', 'tube 600', 'lipbalm flavors', 'flavors available', 'flavors', '600']","['Lip Balm Flavors: Over 600 Options Available', '', '', '', '', '', '', '', '', '']","['my lip stuff tube over 600 lipbalm flavors available you have to try this flavor ! ! it is one of my favorites in the lip stuff line . i have ordered multiple flavors and this one is one of my favorites so far ! 1 i hope to try', 'my lip stuff tube over 600 lipbalm flavors available you have to try this flavor ! ! it is one of my favorites in the lip stuff line . i have ordered multiple flavors and this one is one of my favorites so far ! 1 i hope to try', 'my lip stuff tube over 600 lipbalm flavors available you have to try this flavor ! ! it is one of my favorites in the lip stuff line . i have ordered multiple flavors and this one is one of my favorites so far ! 1 i hope to try']"
129,51,129_nasal_sinus_neti_neti pot,"['nasal', 'sinus', 'neti', 'neti pot', 'pot', 'spray', 'nose', 'entsol', 'sinuses', 'entsol spray']","['Nasal irrigation and sinus relief', '', '', '', '', '', '', '', '', '']","[""sinucleanse sinucleanse neti pot all natural nasal wash system kit after the first use , i felt fine . but later i got a really bad sinus headache that wo n't go away even with lots of advil . i tried the nettie pot again the next day and still"", 'sinucleanse sinucleanse neti pot all natural nasal wash system kit probably one of the best purchases i have made in a long while . i saw this on oprah and decided to give it a shot . my initial reaction on using this neti pot was gross but make no', ""sinucleanse sinucleanse neti pot all natural nasal wash system kit neti pots are amazing i was a total non believer , but it really works . this particular one is very cheaply made and has a very large spout for the nostril . you do n't need pre made solution""]"
130,50,130_acne_acne treatment_clear_treatment,"['acne', 'acne treatment', 'clear', 'treatment', 'clean clear', 'face', 'neutrogena', 'adult acne', 'clearing', 'skin']","['Acne Treatment and Clearing Product Reviews', '', '', '', '', '', '', '', '', '']","['klear action acne treatment system 1 system nice and cheap . did not clear up all acne . big pimples are hard to clear up with this treatment', ""nature 's gate organics acne treatment system with oligopeptide 10 , ( 1 acne treatment system ) i am a 38 year old women with adult acne and i have used every product and they are not magic potions that work over night and i have never found one that"", ""acnease natural acne treatment for teen and adult acne 3 bottles this product did help , no more acne on my back ! ! ! woohoo ... i 'm sure its dependent on how your body will respond , for me 100 of my acne is gone ! ! !""]"
131,50,131_mirror_mount_wall mount_wall,"['mirror', 'mount', 'wall mount', 'wall', 'magnification', 'inch', '5x', 'nickel', 'fog', 'sided']","['Mirror Mounting and Magnification', '', '', '', '', '', '', '', '', '']","[""jerdon 8 inch wall mount mirror the wall mount is cheaply made and one of the bolts attaching the mirror to the mount wo n't hold . the mirror itself is nice , but it 's so not worth what i paid for it ...."", 'jerdon jp2027n 8 inch two sided swivel wall mount mirror with 7x magnification , 20 inch extension , nickel finish i had a square mirror that was almost exactly like this for 20 years and loved it . i could cut my own hair using the mirror because i could', 'jerdon jp2027n 8 inch two sided swivel wall mount mirror with 7x magnification , 20 inch extension , nickel finish i love this mirror and would recommend it to anyone . it is relatively easy to install to the wall . you can adjust the mirror by folding out the']"
132,50,132_sturdy_plastic_hefty_hard plastic,"['sturdy', 'plastic', 'hefty', 'hard plastic', 'broom handle', 'use treats', 'duty plastic', 'heavy duty', 'tamiya', 'plastic coating']","['Toy durability', '', '', '', '', '', '', '', '', '']","[""sturdy , in my opinion . i also do not notice a plastic smell , although maybe it dissipated over time we 've had it for several weeks now . it you use treats in the food ball , i recommend trimming their size we use treats for training and"", ""is very sturdy . it 's pretty much all solid , heavy duty plastic , and very few parts seem at all fragile ( the windmill blades are thin , but they 've survived so far ) . my son is in a throwing stuff phase , but even the"", 'kettle and toaster set no where in the descriptions did it explicitly say that this set is plastic . it is not a heavy duty plastic that is durable , it is cheap and brittle and will not hold up to any amount of play . the toaster broke before']"
133,49,133_wagon_radio flyer_flyer_radio,"['wagon', 'radio flyer', 'flyer', 'radio', 'trailer', 'red', 'pathfinder', 'tires', 'wheels', 'ride']","['Radio Flyer Wagons', '', '', '', '', '', '', '', '', '']","['radio flyer 32s all terrain steel and wood wagon this wagon is awesome ! the big air tires make it really easy to pull and it is a much softer ride for my 3 kids . yes , this wagon is big enough for all 3 of them to go', 'radio flyer 12s classic walker wagon this is a really great wagon , my 10 month old is determined to walk and really enjoys pushing his wagon around , he also loves to ride in it with the sides taken off . the wagon is really well made and sturdy', ""radio flyer trav ler wagon we bought the radio flyer trav ler wagon for our grandson 's 2nd birthday . he was so excited to see the red wagon and loves to go for rides and pulls it all over the backyard . it is so durable and the sides""]"
134,49,134_mask_sleep mask_eye_sleep,"['mask', 'sleep mask', 'eye', 'sleep', 'carry pouch', 'eye pillow', 'contoured', 'earplugs', 'dream', 'essentials']","['Sleep Masks for Comfortable Sleep', '', '', '', '', '', '', '', '', '']","['dream essentials sweet dreams contoured sleep mask with earplugs and carry pouch , black i believe that the nose area could have been more fitted , but i love how this completely blocks out all light', 'dream essentials sweet dreams contoured sleep mask with earplugs and carry pouch , black out of the package it is a near perfect sleep mask . exceptionally comfortable and blocks light except for a little bit around the nose area . sadly , it is not washable or long lasting', ""dream essentials sweet dreams contoured sleep mask with earplugs and carry pouch , black this sleep mask really works . it completely blocks out the light . i also like how there 's space for your eyes to comfortably engage in rem sleep . the earplugs are a bonus as""]"
135,49,135_stars_star_stars instead_rated star,"['stars', 'star', 'stars instead', 'rated star', 'starbuck', 'reason', 'reason stars', 'monev', 'rating', 'rate']","['Product reviews and ratings', '', '', '', '', '', '', '', '', '']","['so bad . that is the only reason for the 3 stars instead of 4 or 5 .', ""quot version . i rated it 1 star for fun , since there is n't a rating below one . two stars for educational since it would be if it worked and five stars for durability since we could n't make a dent on the game itself ."", ""jar of glow stars there are some decently big ones and smaller stars . it 's a little sad that it 's only stars , but i bought it knowing that . as stated in other reviews , do n't use the puddy thing they provide . i think 135""]"
136,48,136_razor_shave_shaver_close,"['razor', 'shave', 'shaver', 'close', 'shaving', 'close shave', 'blade', 'razor does', 'man', 'shavers']","['Shaving Experiences with Razors', '', '', '', '', '', '', '', '', '']","[""is a great first razor , i found it to be quite mild , and decided to change to a more aggressive razor within just a month or two . this would be a great razor for the type of man who 's looking to shave on a daily basis"", 'benefit to this shaver . this product does not work well and i would give it 0 stars if i could . the shaver does not shave well . it takes almost 20 minutes to shave my legs with this shaver because i have to go over the same spots', ""you the shaver is better than advertisted . no burning , close shave , easy to clean . how much more do you want ? i highly recommend the braun syncro 7680 shaving system . it 's worth the cash . plus amazon sent me a free travel shave case""]"
