Topic,Count,Name,Representation,Llama2,Representative_Docs
-1,11470,-1_product_like_toy_just,"['product', 'like', 'toy', 'just', 'use', 'great', 'little', 'skin', 'does', 'hair']","['Parenting products and preferences', '', '', '', '', '', '', '', '', '']","[""short sexy hair short sexy gel hard up ( select option size ) if you have short hair and do n't want 1 strand to move this is the stuff . excellent product that is easy to wash out and works like concrete . best product i 've ever used"", 'hot tools professional curling iron with multi heat control if you need big curls , quickly , use this product . beware , it gets very , very hot . simply and quick to use .', ""my lip stuff tube over 600 lipbalm flavors available i have lemonade ice cream , gummy bear , and banana cheesecake . my little girl love 's these as much as i do , the first one we choose to try was gummy bear and she said it is like""]"
0,913,0_game_cards_games_card,"['game', 'cards', 'games', 'card', 'fun', 'play', 'board', 'deck', 'played', 'playing']","['Family-friendly card games', '', '', '', '', '', '', '', '', '']","[""my mash game this game is so fun it 's the coolest game i 've ever played . everyone should have this game my mom played this game back in the days and she even say it 's cool . anyone who wants a great game to play you should"", 'monopoly the card game i purchased this card game as a spur of the moment christmas gift for my son who loves monopoly but can get no one to play the board game because of how long the board game version takes . my son as well as the rest', ""spite and malice card game i do n't think there 's a better two person card game , that is , a card game that is as much fun with two persons as it is for four or more to play ! ever notice how many games almost require fouror""]"
1,454,1_collar_dog_leash_bark,"['collar', 'dog', 'leash', 'bark', 'dog collar', 'collars', 'leader', 'dogs', 'gentle leader', 'petsafe']","['Dog training collars and their effectiveness', '', '', '', '', '', '', '', '', '']","[""petsafe premier gentlespray citronella anti bark dog collar this device worked when nothing else did . it works on both of our pomeranians . they were constant barkers . they 're smart dogs and still bark when then collar is off , but never make a peep when it 's"", ""gentle leader head collar which is the greatest dog collar harness ever made . the easy walk helps the pulling , but the gentle leader head collar eliminates it . it 's a catch 22 . go with the easy walk and still have a bit of pulling , but"", 'petsafe premier gentlespray citronella anti bark dog collar while it was operative it worked to stop the barking but unfortunately the unit stopped spraying after only 4 days .']"
2,427,2_tea_tea bags_bags_teas,"['tea', 'tea bags', 'bags', 'teas', 'green tea', 'black tea', 'count', 'count tea', 'green', 'bags pack']","['Yogi Tea Varieties', '', '', '', '', '', '', '', '', '']","[""stash green white tea blends , 18 or 20 count tea bags ( pack of 6 ) delicious stuff . no joke . i actually like this tea .. i 'm not exactly a tea drinker , but i drink it at least one thing of tea a day .."", 'yogi echinacea immune support , herbal tea supplement , 16 count tea bags ( pack of 6 ) this tea is wonderful and is caffeine free so you can drink it before bed , enjoy it very much . also reccommend the green tea antioxidant .', 'yogi chai green , herbal tea supplement , 16 count tea bags ( pack of 6 ) have been "" addicted "" to this tea for many years . i even take a few bags with me on vacation ... am so happy to find it cheaper here at amazon']"
3,418,3_eau_women_eau toilette_toilette,"['eau', 'women', 'eau toilette', 'toilette', 'spray', 'cologne', 'perfume', 'toilette spray', 'men', 'parfum']","['Perfumes and Colognes for Women', '', '', '', '', '', '', '', '', '']","['venezia pastello perfume by laura biagiotti for women . eau de toilette spray 2.5 oz 75 ml a very unique fragrance feminine but not sweet or weak , rather for a strong but tender and classy women . too bad it has been discontinued .', ""amarige for women by givenchy eau de toilette spray survey of family and friends was quite positive about givenchys' amarige' floral eau de toilet spray . we love it 's delicate notes of spring . thanks . niki"", 'realities by liz claiborne eau de toilette spray 3.4 oz ( women ) i had ordered the cologne and it was great .. but this perfume must have gotten oxidized , because it smelled sour ... 34 turned stale . 34']"
4,413,4_dog toy_dog_ball_toy,"['dog toy', 'dog', 'ball', 'toy', 'kong', 'chew', 'puppy', 'treat', 'toys', 'squeaker']","['Dog Toys and Treats', '', '', '', '', '', '', '', '', '']","['kong material dog dr . noys\' dog toy our chihuahua terrier mix absolutely loves this toy . but beware ...... we have to have supervised play with her while using this toy . as in the "" disappointed "" review she will chew a hole in the toy within 5', 'kong air kong q tease dog toy , rooster , medium i purchased this for my 5 month old olde english bulldogge puppy she is a large puppy and loves to chew ! she destroys most items but not the kong items ! she loves her crow toy ! it', 'kong classic kong dog toy , red the kong toy is the best dog toy i have ever purchased . i bought one for my golden retreiver when he was a puppy and five years later , the kong is still his favorite toy . even better , the kong']"
5,388,5_doll_barbie_dolls_bratz,"['doll', 'barbie', 'dolls', 'bratz', 'scene', 'cute', 'girl', 'dress', 'pink', 'girls']","[""Girls' fashion dolls: Barbie vs Bratz"", '', '', '', '', '', '', '', '', '']","[""suck , bratz rock . my scene are wanna be , poser dolls , and bratz are n't . the doll is ugly , and bratz are pretty . bottom line"", ""bratz strut it ! collection this is the best cloe doll ever ! she has a hot clothes and i like her a lot . she is a nice doll even better than ol' lame barbie dolls . barbie has to grow up like bratz ."", ""bratz treasure pirate doll yasmin ilove this bratz doll . i named her michelle . she is one of my favorite bratz dolls . and to all u bratz haters , what the heck are u doing here . should n't u be trash talking on barbie mermadia or something""]"
6,381,6_litter_litter box_box_cat,"['litter', 'litter box', 'box', 'cat', 'scoop', 'littermaid', 'cats', 'self', 'self cleaning', 'cleaning']","['Litter Box Reviews and Comparison', '', '', '', '', '', '', '', '', '']","['scoopfree self cleaning litter box in the past had the litter maid brand always had problems . this litter box had worked efficiently from the beginning . there was no need to meld the litter from the old box to this new one . our cat went immediately to the', ""littermaid elite basic self cleaning litter box one of the worst designs imaginable . wo n't scoop even a clean litter box , much less any clumps from cat waste . if you want a self cleaning litter box that is n't self cleaning , go ahead and buy this"", '. i have found no problem with the top not adhering to the bottom of the litter box , although i would never carry a litter box by its handle as with the litter in the litter box this makes the litter box way too heavy to depend on a']"
7,311,7_price_worth_recommend_money,"['price', 'worth', 'recommend', 'money', 'purchase', 'quality', 'product', 'highly recommend', 'highly', 'buy']","['Product reviews and recommendations', '', '', '', '', '', '', '', '', '']","[""it alot , so i guess it was worth the money . at the current amazon price , you really ca n't go wrong ."", 'been such a help . highly recommend .', '. i highly recommend this 4 pack !']"
8,259,8_vitamin_vitamins_energy_weight,"['vitamin', 'vitamins', 'energy', 'weight', 'taking', 'supplements', 'supplement', 'source', 'capsules', 'weight loss']","['Weight Loss Supplements', '', '', '', '', '', '', '', '', '']","['one a day womens active metabolism multivitamin 165 tablets i was very excited to take this vitamin hoping it would give me a boost of energy . i took the vitamin after eating and within 5 minutes i threw it all up ! ! an hour later and i still', 'lipovarin 150 caps thermogenic weight loss diet pill i have had extreme success with lipovarin . i just hope i can maintain my weight loss after i stop taking it !', 'metabolic thyrolean , twinpack , 120 120 caps i guess i was hoping for that "" magic pill "" that would get me jump started on my weight loss . this product was n\'t it . no noticeable weight loss , minimal boost of metabolism and energy . i \'m']"
9,224,9_fountain_water_pet fountain_pet,"['fountain', 'water', 'pet fountain', 'pet', 'bowl', 'faucet', 'platinum', 'cats', 'reservoir', 'filters']","['Pet Water Fountains: Pros, Cons, and Maintenance', '', '', '', '', '', '', '', '', '']","['aspen pet cool flow pet fountain this is my fourth pet mate water fountain . and i do love how they keep the water circulating and the kitties drinking . but the first one i had lasted two years before the motor wore out and possibly part of the housing', ""aspen pet cool flow pet fountain the fountain works fine and seems to be well designed and constructed . my cat drank out of it once when i first got it , but has n't touched it since . i 've tried fresh water , filtered water , with the"", 'drinkwell original pet fountain we bought the drinkwell pet fountain because my cat loves to drink out of the bathroom faucet . we have had many issues with it being dirty . we have to completely empty , dismantle and disinfect it every two to three days , or it']"
10,200,10_toys_toy_play_mirror,"['toys', 'toy', 'play', 'mirror', 'loves', 'horse', 'keeps', 'wants', 'gets', 'music']","['Infant Playtime Preferences', '', '', '', '', '', '', '', '', '']","['which none of his others toys can .', ""himself in the mirror he 's fascinated by it . he also enjoys kicking the various quot noise makers quot the crinkly elephant ear and the squeak toy by the monkey . this is also good for when baby wants to be on his back lots of hanging toys that"", 'he loves pushing the lever to make the gumball machine play music . he also likes to try digging the balls out of the top of the toy . he will play with the gumball machine for 30 min . to an hour or so before he wants to move']"
11,196,11_toy_toys_triangle_play,"['toy', 'toys', 'triangle', 'play', 'months', 'interested', 'plays', 'likes', 'favorite toys', 'll']","['Parenting and toddler development', '', '', '', '', '', '', '', '', '']","[""it across the room and i feel like a dog playing fetch ) i think i like the toy more than she does , especially the sounds it makes . perhaps she 'll begin to enjoy it more again , who knows what cycles these little ones go through ,"", 'names and especially what those names are . i have said , "" where \'s the triangle ? go get the triangle . let \'s put the triangle in this hole . "" when she was 13 months , half the time i \'d have to go pick up the', ""triangle because there were too many things and she did n't know which object the triangle was but eventually she learned it and now she knows which hole the triangle goes in . i 'm sure if i was more vocal with colors she would be there too . i""]"
12,188,12_gate_gates_north states_north,"['gate', 'gates', 'north states', 'north', 'stairs', 'hands free', 'extra tall', 'states', 'install', 'extension']","['Gate options for baby proofing', '', '', '', '', '', '', '', '', '']","['dreambaby extra tall swing close gate i bought this gate for my dogs , and it is perfect . i keep it up in my doorway and do not regret it at all . it is tall , easy to put together , sturdy , and overall a great gate', 'the first years simple secure stair gate we purchased this gate in december 2005 . our twin boys started crawling and we needed a gate for the top of the stairs . this gate worked great for about 5 months and then the knobs broke . our friends have the', 'dreambaby extra tall swing close gate this gate is simply amazing and offers a piece of mind . i have received many compliments on my gate . we own the white gate and the black . the gate was easy to assemble and has stumped many adults ! sofar this']"
13,186,13_massager_massage_pain_massaging,"['massager', 'massage', 'pain', 'massaging', 'therapist', 'wand', 'neck', 'magic wand', 'hitachi', 'homedics']","['Massagers for pain relief', '', '', '', '', '', '', '', '', '']","['wahl 4120 200 all body massage powerful therapeutic massager in pharmacy box i have a lot of minor aches and pains and this wahl personal massager puts the massage right where it needs to be . most recently purchased for a pinched nerve in my elbow . i use the', ""massager for a few mnutes and get a few hours of natural pain relief . i recommend this wondeful massager for the anyone with aches and pains , and who does n't have a personal massager . if you have to do things by your self this is the massager"", ""wahl 4120 200 all body massage powerful therapeutic massager in pharmacy box this product is o.k . for the price . however one of the massager pieces was not made properly and would not fit on to the base ergo it would n't work . it was one of the""]"
14,183,14_color_hair_hair color_henna,"['color', 'hair', 'hair color', 'henna', 'brown', 'blonde', 'dye', 'gray', 'permanent', 'coloring']","['Hair coloring and dyeing', '', '', '', '', '', '', '', '', '']","[""surya henna henna cream light brown this hair coloring brand is the best i 've ever used and i 've been coloring my own hair for 23 years . i am very grey and have long hair . my hair feels softer than it has since my teens . love"", ""dark and lovely reviving semi permanent hair color i love this semi permanent hair color . it has built in detangler so it makes it really easy to comb through . excess dye washes right off of scalp , does n't have an odor , and does n't burn the"", 'surya henna henna cream light brown i have naturally curly hair in a dark brown color and wanted the strawberry blonde boost for the summer however this product did not lighten up my hair color very much however it did make it really soft . i might try a lighter']"
15,179,15_diaper_champ_pail_diaper champ,"['diaper', 'champ', 'pail', 'diaper champ', 'genie', 'baby trend', 'trend', 'diapers', 'diaper pail', 'smell']","['Diaper Pail Reviews: Baby Trend Champ', '', '', '', '', '', '', '', '', '']","['baby trend diaper champ we purchased this diaper pail after trying the "" odorless "" pail for 14 and the "" diaper genie "" ( second hand ) for 5 . i was very disappointed with the performance and smell of the odorless pail , and very suprised at the', 'baby trend diaper champ i love this diaper pail ! my kids are very close together and we are working on our second one now after three years and two still in diapers ! ! it is more exspensive than the other pails , but really worth it ! !', ""baby trend diaper champ first of all , i do n't know of a single diaper pail will keep the odor of a poopy diaper contained . those go right in the garbage outside ! this diaper pail is economical , you can buy bulk garbage bags or even scented""]"
16,174,16_pillow_boppy_pillows_snoogle,"['pillow', 'boppy', 'pillows', 'snoogle', 'pregnancy', 'leachco', 'support', 'sleep', 'belly', 'wedge']","['Pregnancy Pillow Options', '', '', '', '', '', '', '', '', '']","[""leachco back 'n belly contoured body pillow i could n't even get comfortable for 5 mins with this pillow much less try it for a whole night . it 's huge , bulky and the top of the pillow where it rounds just digs into your neck . i sent"", 'my brest friend pillow i love this pillow and it makes breastfeeding so much easier ! for the tigh budget , this is not an essential item though and you might get a free pillow at the hospital , typically a boppy . i use the boppy pillow to support', ""leachco back 'n belly contoured body pillow i was never a good sleeper . then i was about 4 months pregnant and not sleeping at all . heard great things about this pillow . none of them were lies . it is heaven . since receiving this pillow and now""]"
17,170,17_lotion_skin_cream_dry skin,"['lotion', 'skin', 'cream', 'dry skin', 'oz', 'lotions', 'moisturizer', 'body', 'moisturizing', 'body lotion']","['Best Body Lotions for Dry Skin', '', '', '', '', '', '', '', '', '']","['queen helene mango cocoa butter hand and body lotion body lotions this works great for dry skin problems i have had and it smells great as well', 'rubee hand body lotion 16 oz . i knew this lotion since i was in cameroon , in africa . when i came in usa , i found it and i was very happy ! ! it smell good , keep your skin moisturized , and helps protects from the', 'avalon organics hand body lotion , 12 oz first time i tried this lotion and i am hooked . the lavender smell is refreshing and strong , and the lotion leaves your skin feeling soft and moisturized . i like that my skin feels revitalized after i put the lotion']"
18,169,18_protein_whey_nutrition_whey protein,"['protein', 'whey', 'nutrition', 'whey protein', '100 whey', 'optimum nutrition', 'powder', 'optimum', 'gold standard', 'protein powder']","['Protein Powder Comparison', '', '', '', '', '', '', '', '', '']","[""now foods whey protein this is the finest protein powder i 've found so far . 1st , it 's mostly protein . 25g in 28g serving 89 protein . very good . if it 's not protein in the other brands , what is it ? a lot of"", ""optimum nutrition 100 whey gold standard i 'm a 40 something mom who works out regularly and wanted to start using whey protein as a recovery meal after working out . at 24 grams of protein per serving , it 's hard to rival as a quick , low calorie"", ""optimum nutrition 100 whey gold standard on protein not only taste great but it mixes easy with water as well ( for the portable shakers ) . i 've tried many different protein powders and on whey is by far the best one . it 's a good protein supplement""]"
19,166,19_pump_medela_breast_breast pump,"['pump', 'medela', 'breast', 'breast pump', 'isis', 'pumping', 'pump style', 'medela pump', 'pumps', 'manual']","['Breast Pump Comparison: Medela vs Evenflo', '', '', '', '', '', '', '', '', '']","[""evenflo comfort select dual auto cycling breast pump we bought this pump as an emergency backup . it is good enough to be a cheap item that you keep in your car , but i 'd never have considered this to replace my medela pump in style advanced . the"", 'medela swing breast pump i just received this pump after trying to pump manually and this little pump is so great ! i tried so many times to manually pump and it is extremely tiring and i was only getting 2 ounces total from both sides ! this pump works', ""medela swing breast pump it does a wonderful job . i do n't have to pump every day . if i do have to pump the pump is very easy to put together and i can pump what i need in ten minutes .""]"
20,165,20_shampoo_conditioner_hair_oz,"['shampoo', 'conditioner', 'hair', 'oz', 'scalp', 'shampoos', 'shampoo conditioner', 'dry', 'dry shampoo', 'select option']","['Hair care products and their effectiveness', '', '', '', '', '', '', '', '', '']","[""f.a.s.t . nisim fast shampoo conditioner 12 oz . each for fast hair growth ! i have been using nisim fast shampoo for about a week now . i already am in love with this product ! i use it every day as directed and it does n't dry my"", 'f.a.s.t . hair growth shampoo and conditioner combo pack 12 fl . oz . each love this shampoo and conditioner ! smells great ! it is also worth the price ! not positive about whether it has made my hair grow faster but i think it has . my hair', ""f.a.s.t . nisim fast shampoo conditioner 12 oz . each for fast hair growth ! there is nothing special about this product it is just regular shampoo and it made my scalp dry my hair did n't even grow""]"
21,161,21_toe_heel_ankle_feet,"['toe', 'heel', 'ankle', 'feet', 'arch', 'shoes', 'foot', 'knee', 'jobst', 'socks']","['Foot care and orthotics', '', '', '', '', '', '', '', '', '']","['medi dyne diamondbacks arch w gel heel i have heel spurs nd pf , i got these hoping that my feet would not hurt anymore through out the day . i love these . i love that i can place them in any pair of shoes i own . the', 'jobst supportwear ultra sheer knee high i purchased these support stockings for my mother due to her legs swelling . when she wears them , she has no swelling at all . they have worked great .', 'toe stretchers for beautiful healthy feet for men and women small size i have toes that bend in crazy directions . it was almost impossible to wear shoes for an entire day without crippling pain even ugly orthopedic shoes ! i was even considering toe surgery . i was very']"
22,159,22_bottles_avent_nipple_bottle,"['bottles', 'avent', 'nipple', 'bottle', 'playtex', 'dr brown', 'nipples', 'dr', 'philips avent', 'flow']","['Baby Bottles Comparison', '', '', '', '', '', '', '', '', '']","['philips avent 3 pack bottles everyone used to tell me that avent bottles were the best . they were supposed to give out less air and cause less gas for the baby . when my son was born we had to give him both breast and bottle . when it', ""dr . brown 's 4 oz natural flow baby bottle , 3 pack i truly believe in dr . brown bottles ! our baby girl is five weeks old and these bottles helped with her colic and fussiness during and after eating . we used the avent bottles and they"", ""she was taking with her other bottles . however , stage 2 with these nipples is much faster a flow then our other bottles ( which are avent ) . we love the avent bottles , but unfortunately they are n't totally bpa free . the measurement thing comes in""]"
23,159,23_tub_bath_sling_bathtub,"['tub', 'bath', 'sling', 'bathtub', 'infant', 'bath tub', 'baby', 'eurobath', 'safety 1st', 'infant toddler']","['Parenting challenges with infant bathtubs', '', '', '', '', '', '', '', '', '']","['side of the tub . i would suggest a smaller tub for newborns , but they all seem to be made in china .', 'of money . anyways the night i gave my son a bath in this tub he was splashing and kicking and loving every minute of being in his new tub instead of crying in his tub he crys when it is time to get out of the tub . im', ""the first year 's infant to toddler tub with sling this is the first tub i had for my baby and i found it more of a hassle than it would have been to hold her in the tub with me . i constantly had to hold her head so""]"
24,158,24_iron_ceramic_flat_flat iron,"['iron', 'ceramic', 'flat', 'flat iron', 'chi', 'straightener', 'farouk chi', 'farouk', 'inch', 'hairstyling']","['Hair styling tools: Farouk Chi flat irons', '', '', '', '', '', '', '', '', '']","['farouk chi gf1539 turbo big 2 inch ceramic flat iron hair straightener i bought this flat iron for my 15 yeard old daughter on a recommendation of a friend . my daughter simply loves this flat iron . in fact , on friday nights many of her friends will gather', 'farouk chi 1 inch ceramic flat hairstyling iron great product ! i have purchased two others as gifts for people . best ceramic iron on the market ! ! !', ""farouk chi 1 inch ceramic flat hairstyling iron i bought this flat iron for my daughter and after a year it broke . now this would n't be a big deal had it not happened twice before in the other two flat irons we bought as well . the wiring""]"
25,156,25_clean_cleaner_cleaning_washing,"['clean', 'cleaner', 'cleaning', 'washing', 'wipe', 'washing machine', 'blinds', 'washes', 'water', 'cleaner 28']","['Cleaning and maintenance of ceramic cooktops', '', '', '', '', '', '', '', '', '']","['cerama bryte ceramic cooktop cleaner ( 28 oz ) , scraper and 5 cleaning pads combo kit yeah amazon , the best price on this kit by far , fast delivery too as usual . it works like the reviews say . i do find that if my stovetop is', 'cerama bryte ceramic cooktop cleaner ( 28 oz ) , scraper and 5 cleaning pads combo kit i first thought that any cleaner cleanser would work on my glass cook top but boy was i wrong . only cerama bryte got the tough stains off and left the range looking', ""cerama bryte ceramic cooktop cleaner ( 28 oz ) , scraper and 5 cleaning pads combo kit i almost did n't believe that this would work . i have a new stove and while cooking on it , some food spilled over and continued cooking for a few hours .""]"
26,150,26_bed_folds_queen_easily,"['bed', 'folds', 'queen', 'easily', 'beds', 'fold', 'floor', 'room', 'sleeping', 'trunk']","['Queen Bed Folding and Storage', '', '', '', '', '', '', '', '', '']","['useful beside my bed after surgery . however , it must be disassembled for storage . i was disappointed that it did not just fold down did not come apart easily to store .', ""easier for me to feed her in bed safely even when she 's feeding on the side closest to the edge of the bed . one important adjustment i made is to stuff rolled up towels in the space between the bed and the rail so that my daughter would"", 'walk around the bed trying to get up ... i would have to get up try to get ahold of her and put her in bed with us . since we acquire the steps she can come and go as she wants without having to get out of bed and']"
27,149,27_candy_haribo_gummi_chips,"['candy', 'haribo', 'gummi', 'chips', 'bears', 'ounce bags', 'bag', 'gummy', 'pound bag', 'bags']","['Gummy Candy Preferences', '', '', '', '', '', '', '', '', '']","['haribo gummy candy , sugarless gummy bears , 5 pound bag these gummi bears have a great taste and are sugar free , and the price is right . what more could you ask for .', ""haribo gummi candy , original gold bears , 5 ounce bags ( pack of 12 ) i love these gummy bears . they put me into a sugar coma though , so i try to only eat them every once in a while , but you ca n't beat the"", 'haribo gummi candy , original gold bears , 5 ounce bags ( pack of 12 ) everyone loved them . haribo gummi candy , original gold bears , 5 ounce bags ( pack of 12 )']"
