Topic,Count,Name,Representation,Llama2,Representative_Docs
191,32,191_gillette_cartridges_fusion_razor,"['gillette', 'cartridges', 'fusion', 'razor', 'gillette fusion', 'cartridge', 'blades', 'mach3', 'mach', 'm3']","['Gillette Razors and Cartridges', '', '', '', '', '', '', '', '', '']","[""gillette fusion manual cartridges i 've been the u.s . army for 22 years , 8 months now . shave at least five days a week . i have never had a razar that shaved so well . i was given the gillette fusion before my deploymet to afghanistan in"", 'gillette fusion power cartridges definatly like the gillette fusion power , and if you buy the blades online it comes out to be like . 50 cents a week , thats cheap as can be . gives me a great shave , glad i upgraded from my mach 3 .', 'gillette fusion manual cartridges i have been using gillette products for 40 years . these fusion blades do not klast 5 shaves the green strip turns white and the blades are not that sharp . you get about 5 good shaves and then forget it . i am moving to']"
192,32,192_broom_sweep_reacher_bissell,"['broom', 'sweep', 'reacher', 'bissell', 'sweeper', 'aluminum', 'swift', 'dustpan', 'tool', 'dust']","['Broom and Dustpan Reviews', '', '', '', '', '', '', '', '', '']","['oxo good grips upright broom and dustpan set , silver this combo looked like another great design from oxo . unfortunately , it has 2 critical flaws . 1 ) the broom is waaay too short . i \'m 5\'5 "" and my girlfriend is 5\'3 "" , both of', 'camco 43623 rv adjustable broom and dustpan a handy , funtional , well made broom that does exactly what it says . i use this broom daily . it collapses down easily . when the handle is extended , it stays extended and does not collapse as you sweep .', 'oxo good grips upright broom and dustpan set , silver my daughter asked that i send a little broom to my grandson for his birthday , since he is always taking the big broom and trying to sweep . the minute the box was opened , he grinned , took']"
193,32,193_bubble_bath_bubbles_bucket,"['bubble', 'bath', 'bubbles', 'bucket', 'tub', 'spill', 'elegant baby', 'party', 'toysmith', 'elegant']","[""Toy options for young children's bath time"", '', '', '', '', '', '', '', '', '']","[""catch a bubble jumbo 5 pack i bought these bubbles to be part of my daughter 's fairy themed birthday party . i envisioned little fairies , with wings and floral head wreaths , skipping around catching and holding bubbles . while the party was terrific , the bubbles were"", ""little kids no spill big bubble bucket , colors may vary we love this bubble bucket . three kids can play at once , that 's what i like about it . the bubble wands are big and easy to grab hold of and easy to dip too . we"", 'elegant baby 6 piece bath squirties gift set in vinyl zip bag we bought these for our grandson he loves them plays with them everytime he is in his tub very colorful and cute']"
194,32,194_wet dry_panasonic_shaver_wet,"['wet dry', 'panasonic', 'shaver', 'wet', 'shave', 'pro curve', 'dry shaver', 'dry', 'ladies', 'pivot']","['Panasonic Wet Dry Shavers', '', '', '', '', '', '', '', '', '']","['panasonic es2206ac rechargeable ladies wet dry shaver panasonic es2206ac rechargeable ladies wet dry shavermy wife loves this shaver , says that it is much better than a blade razor , just as close a shave and no nicks , easy to keep clean . as i said my wife is', 'panasonic es8162s pro curve elite convex wet dry rechargeable shaver , black i have never written a review before for any product . i was a blade shaver for 40 years . i have tried electric razors in the past ( including a panasonic wet dry shaver about 15 years', 'panasonic es8043sc pro curve pivot action linear wet dry shaver , silver i am a long time user of panasonic wet dry shavers and have used an es8066 for the last 5 years . i looked at many options and read many reviews before deciding to buy the panasonic es8043']"
195,32,195_tent_tents_pacific_tunnel,"['tent', 'tents', 'pacific', 'tunnel', 'tunnels', 'play', 'play tent', 'tent bought', 'fort', 'playhut']","['Play tents and imaginative play', '', '', '', '', '', '', '', '', '']","[""pacific play tents super duper 4 kids tent we bought this tent for our twin boys' 7th birthday . they had been building forts throughout the house with every blanket and pillow in sight ... and i was exhausted from putting everything back day after day . this tent was"", 'pacific play tents super duper 4 kids tent we ordered this bright colored tent for our three year old son . he had six friends over to play and they had a blast running in and out of it . the tent is the perfect place for imaginative play ,', 'pacific play tents lil nursery tent this play tent is easy to set up and safe for any child over 4mo to play in .']"
196,32,196_syrup_maple_sugar_maple sugar,"['syrup', 'maple', 'sugar', 'maple sugar', 'maple syrup', 'organic', 'wholesome', 'sweeteners', 'farms', 'cane sugar']","['Natural Sweeteners from Maple Farms', '', '', '', '', '', '', '', '', '']","[""coombs family farms 100 organic maple sugar , 25 ounce container i like maple sugar for flavoring homemade oatmeal and other things , and coombs is generally good quality maple products . if you have n't tried maple sugar , you 're missing out . i 've used coombs for"", 'shady maple farms organic maple syrup , grade b , 32 ounce jug shady maple sets the bar for all syrup . superb flavor . organic methods . 100 maple syrup , no garbage . absolutely outstanding . i am so sorry it is now out of stock ! !', 'coombs family farms 100 organic maple sugar , 25 ounce container great stuff ! i have been using their pure maple syrup ( and still do ) so i thought i would give this product a try ... so far i have used it in the following ways to sweeten']"
197,32,197_magnetic_alphabet_phonics_fridge phonics,"['magnetic', 'alphabet', 'phonics', 'fridge phonics', 'fridge', 'letters', 'set styles', 'letter', 'leapfrog fridge', 'styles vary']","['LeapFrog Fridge Phonics Label', '', '', '', '', '', '', '', '', '']","['leapfrog fridge phonics magnetic alphabet set styles may vary i have several of the leap frog products and this one was the worst . as we took it out of the box and started putting in the letters the hand held toy would say the wrong letter . after putting', 'leapfrog fridge phonics magnetic alphabet set styles may vary we purchased the fridge phonics for our daughter when she was about 13 months old to keep her entertained in the kitchen while i cooked or cleaned up after meals . she learned a few letters very quickly and by the', 'leapfrog fridge phonics magnetic alphabet set styles may vary we bought this toy for my speech delayed 2 year old and she loves it . she is obssessed with the alphabet and constantly brings the little magnets to us and tells us what letter it is . she knows the']"
198,32,198_vibrator_doc johnson_waterproof_doc,"['vibrator', 'doc johnson', 'waterproof', 'doc', 'multi speed', 'speed waterproof', 'spot vibrator', 'twist control', 'johnson', 'waterproof spot']","['Adult Product Reviews', '', '', '', '', '', '', '', '', '']","['doc johnson lucid dream 14 multi speed , waterproof g spot vibrator , twist bottom control while a little painful to start , once you get used to this it will give you the g orgasm of your life .', 'doc johnson lucid dream 14 multi speed , waterproof g spot vibrator , twist bottom control doc johnson sex toys are fantastic ! i bought this for my wife and she just loved it , my only quirk is i wish it had more power ! ! you can never', 'doc johnson lucid dream 14 multi speed , waterproof g spot vibrator , twist bottom control i hear her light breathing coming from the bathroom . the door is slightly ajar . i move for the handle and inch it open . i trace her long elegant back and womanly']"
199,31,199_leappad_leap pad_leap_pad,"['leappad', 'leap pad', 'leap', 'pad', 'books', 'leappad learning', 'leapfrog', 'book', 'microphone', 'educational book']","['LeapFrog Learning Books', '', '', '', '', '', '', '', '', '']","[') if debating between this pad with the microphone or the regular leap pad .... by all means .... pick up the one with the microphone . microphone leap pad plays regular leap pad books as well as the microphone books . my 4 year old daughter and 2 year', 'leapfrog my first leappad educational book this leap pad book is excellent my 3 year old loved it i think she learnt a lot with this one', 'leappad with microphone we have all of the leap pad systems , little touch , my first leap pad and the regular leap pad . this leap pad is the one that gets played with the most ( the least is the little touch .... but that is another review']"
200,31,200_diapers_diapers packaging_dry diapers_pampers baby,"['diapers', 'diapers packaging', 'dry diapers', 'pampers baby', 'packaging vary', 'baby dry', 'pampers', 'packaging', 'vary', 'dry']","['Pampers Baby Dry Diapers - Packaging Variety and Convenient Delivery', '', '', '', '', '', '', '', '', '']","[""pampers baby dry diapers ( packaging may vary ) very good service . you should subscribe it too ! it 's convenient and fast . i never need to carry a heavy diaper box myself any more . it 's delivered to your house and cheaper than the market price"", 'pampers baby dry diapers ( packaging may vary ) the diapers are exactly what you find in the store ! and they always arrive on time !', 'pampers baby dry diapers ( packaging may vary ) the pampers baby dry diapers 228 count is the best deal you can possibly get . there are none that even come close . delivery was amazing it only took 3 days to arrive at my house . the diapers last']"
201,31,201_cookies_cookie_trans fats_wafer,"['cookies', 'cookie', 'trans fats', 'wafer', 'nana', 'yummy', 'trans', 'taste', 'fats', 'vegan']","['Vegan Cookie Options', '', '', '', '', '', '', '', '', '']","['dare cookies , maple leaf creme , 12 . 3 ounce packages ( pack of 12 ) they have an authentic maple taste . these cookies were a great value . most cookies arrived intact despite the shipping . what more can i say ?', ""nana 's single serve cookies , 3 . 5 ounce packages ( pack of 12 ) i purchsed nana 's coconut chip cookies at amazon and loved them . incredibly moist , luscious and yummy , these oversized cookies are as satisfying as they are good for you . with"", ""pamela 's simplebites mini cookies these cookies are better than any cookies i have tasted . i am very particular about low fat , gulten free items because they do not taste as they should , but these are very good .""]"
202,31,202_mildew_mold_residue_diffuser,"['mildew', 'mold', 'residue', 'diffuser', 'leather', 'simulated', 'air diffuser', 'black mold', 'soap water', 'cold air']","['Removing Mildew and Mold', '', '', '', '', '', '', '', '', '']","['cold air diffuser after i read that tea tree oil or thieves blend essential oils can kill black mold in an entire house . when i read about thieves blend it said the diffuser must be a cold air diffuser so the molecular structure of the oils is not altered', ""done using it , so you do n't have to worry about mildew . if for some reason you do get some mildew in it , soak it in hot water and one cup white vinegar for an hour , then wash in your washing machine and it should be"", 'refrigerator that had grown black mildew in the folds of the sealer . in this case , i managed to scrub the mildew away with a sponge , but the same thing occurs when i only use soap and water . also , this product does not prevent mildew from']"
203,31,203_shampoo_vet_shampoo 16_dogs,"['shampoo', 'vet', 'shampoo 16', 'dogs', 'humans', 'dog', 'dandruff', 'mild', 'gallon used', 'dog skin']","['Dog Shampoos for Skin Issues', '', '', '', '', '', '', '', '', '']","[""allergroom shampoo gallon we used this shampoo on our last dog , who sometimes had skin allergies . it 's the best product and this size is the best price . we have started our new goldy on the same and her coat looks and smells great ! it is"", 'epi soothe oatmeal shampoo 16 oz my dog has had itchy skin problems . this shampoo and fish oil has worked well . smell is clean and neutral .', 'natural oatmeal shampoo gallon i have used this shampoo on my westies for several years and it works great . they have no allergy problems with this shampoo and they are soft , clean , and smell great after a bath with it .']"
204,30,204_razor_merkur_safety razor_safety,"['razor', 'merkur', 'safety razor', 'safety', 'shaving', 'straight razor', 'blades', 'straight', 'razors', 'mower']","['Wet shaving with Merkur razors', '', '', '', '', '', '', '', '', '']","['merkur "" futur "" safety razor , satin finish i went from 30 years of full beard to clean shaven . tried all the electrics and then found a review for the merkur . wow ! i love shaving . this razor and their stainless blades along with a nice', ""merkur long handled chrome safety razor this is the first safety razor that i purchased , and i 'm relatively pleased with the razor . i originally bought it based on a recommendation from the art of manliness website regarding wet shaving . although i do state that the razor"", 'merkur model 178 classic safety razor , straight merkur classic safety razor , straight 178 made in germanyi read the reviews and thought i would give it a try . my wife had complained that my beard was like sandpaper . i got a shaving brush , shaving soap ,']"
205,30,205_pirate_pirates_pirate ship_ship,"['pirate', 'pirates', 'pirate ship', 'ship', 'imaginext', 'adventures', 'pirates caribbean', 'caribbean', 'harry potter', 'potter']","['Pirate-themed toys and playsets', '', '', '', '', '', '', '', '', '']","[""small world toys ryan 's room pirates of the sea pirate ship this pirate ship is very nice . it was easy to assemble . it would have been nice if it had come with some of the pirate figures that were shown in the pictures . they used to"", 'fisher price imaginext adventures pirate ship we got this pirate ship for our four year old grandson for christmas . it was his favorite present ! also his 13 year old and 2 year old cousins loved playing with the toy .', ""fisher price imaginext adventures pirate ship fisher price imaginext adventures pirate shipa high priority on grandson 's wish list . he became a pirate and really loved the treasure chest !""]"
206,30,206_transformers_hot shot_mode_shot,"['transformers', 'hot shot', 'mode', 'shot', 'robot mode', 'robot', 'energon', 'bumblebee', 'camaro', 'hot']","['Transformers Hot Shot', '', '', '', '', '', '', '', '', '']","[""transformers energon deluxe hot shot hot shot is a bit of a personal fave . he reminds me greatly of when i was younger and would play with my older cousins' transformers . hot shot is pretty durable and somewhat poseable . as far as his powerlinx combos go ,"", 'transformers energon deluxe hot shot this is a good transformers . the robot mode looks good , with very little kibble to get in the way . the car mode looks good . as the legs of a powerlinx , he is so so . he makes a decent top', ""hot shot transformers cybertron deluxe unlike hot shot 's previous two incarnations from the energon saga , this one neither has an ugly robot mode , nor is fragile . instead , this one is one of the best transformers toys of all time . first of all , the""]"
207,30,207_def_extra money_money buy_hope,"['def', 'extra money', 'money buy', 'hope', 'run', 'friend really', 'want actually', 'work school', 'purchase difference', 've seriously']","[""Coffee enthusiast's budgeting struggles"", '', '', '', '', '', '', '', '', '']","['i just gave up . i work , i go to school , and i am a wife . i am busy ! finally i went swimming suit shopping and for the first time ever i had to buy a non bikini . so depressing . i have friends that', 'and i just hope that all of you have one too if this were to happen to you . def a must have for anyone who worries like i do it is def worth the money . hope this helps .', 'a new car with the extra money . i am now saving to do just that ! all without sacrificing the great taste of a fresh cup of premium coffee whenever i want it !']"
208,30,208_luna_bars_69 ounce_69,"['luna', 'bars', '69 ounce', '69', 'ounce bars', 'ounce', 'bars love', 'bar', 'chocolate', 'lemon']","['Luna Bars: Nutritious and Delicious', '', '', '', '', '', '', '', '', '']","['luna bars , 1 . 69 ounce bars these are one of my favorite flavors of luna bars . what i love about luna bars is that they are packed with vitamins , minerals , and herbal supplementation and they taste great . they are also made with organic ingredients', ""luna bars , 1 . 69 ounce bars wondering why these are still listed as 'in stock' , when they are not in stock and , in fact , no longer being made by clif luna ? ?"", 'luna bars , 1 . 69 ounce bars luna bars , caramel nut brownie , 1 . 69 ounce bars ( pack of 15 ) they were purchased for my 21 year old daughter who loves them and says they helped her finish in the top third of a half']"
209,30,209_steps_stairs_plus pet_solvit,"['steps', 'stairs', 'plus pet', 'solvit', 'pet', 'doggy', 'plus', 'bed', 'step', 'skid']","['Pet Stairs and Steps', '', '', '', '', '', '', '', '', '']","[""solvit pupstep plus pet stairs my dog loves the steps . they 're super steardy , and collapse easily to store under my bed ."", ""solvit pupstep plus pet stairs my cat could no longer jump up on our bed and was unhappy about it . these steps were an easy solution and she 's happily sleeping with us again . assembly"", 'solvit pupstep plus pet stairs i bought these steps for my yorkie to get on and off the bed . the steps are well made and they look nicer than the picture . they come with "" anti skid "" pads , but if you have hardwood floors , the']"
210,30,210_shave_shaving_proraso_razor,"['shave', 'shaving', 'proraso', 'razor', 'lube', 'jack black', 'irritation', 'razor burn', 'face', 'burn']","['Shaving and skincare products for sensitive skin', '', '', '', '', '', '', '', '', '']","[""jack black beard lube conditioning shave i have a tendency to nick areas of the neck . decided to buy this product despite not being the type to splurge on much for myself . at 16 . 00 for shave cream i 'd consider this a splurge . smells and"", 'jack black beard lube conditioning shave i have very sensitive skin , and jack black beard lube is smoothest shave i have ever experienced . regardless of skin type , i would suggest this beard conditioning lube to anyone .', 'proraso proraso liquid cream after shave 3 . 4oz i own this product along with the proraso shaving cream and its the best after shave lotion on the market today . proraso has high quality products that are the first that have never caused me the get razor bumps or']"
211,30,211_basket_badger basket_badger_pink white,"['basket', 'badger basket', 'badger', 'pink white', 'moses', 'doll crib', 'moses basket', 'bedding', 'baskets', 'white']","['Baby Baskets and Cribs', '', '', '', '', '', '', '', '', '']","[""badger basket company natural baby moses basket love the basket wand it was perfect for what we used it for . i just thought it would be a bit more sturdy . not that i think it 's going to fall apart or anything . it was dedinitely a good"", 'badger basket natural moses basket with hood i bought this when my daughter was a couple weeks old . i had a hard time getting her to nap sleep anywhere except my arms , but she did nap many times in this adorable basket . the only con i would', ""badger basket canopy doll crib with baskets bedding and mobile pink white i love this crib ! it 's beautiful , easy to set up and very functional . i bought this for my 4 year old daughter and she plays with it all day . i specifically like the""]"
212,30,212_durable_pizza_dropped times_sturdy durable,"['durable', 'pizza', 'dropped times', 'sturdy durable', 'dropped', 'durability', 'cd player', 'carton', 'darn', 'fragile']","[""Durable children's products"", '', '', '', '', '', '', '', '', '']","[""very durable . you slide the dark charcoal handles inwards in order to open the carrier . press down the top of the carrier if it 's getting stuck this helps the handles to slide smoothly outward or inward . i also like that there is a small opening on"", 'darn it , yes ! it is sturdy and durable . it has sat out it the rain as well , and shows no signs of problems , or discolorations . looks like new . now that is something ! would i buy it again ? probably . yes .', ""twinkle 'n twirl cd player by playskool our little noah ( 7 months ) likes to use the cd player to pound on things , so yes it is very durable . as for educational , we have learned something and that is that we need to think before we""]"
213,29,213_horse_breyer_saddle_horses,"['horse', 'breyer', 'saddle', 'horses', 'rocking', 'tawny', 'spring horse', 'barn', 'derby', 'radio flyer']","[""Horse enthusiasts' favorite models and activities"", '', '', '', '', '', '', '', '', '']","['its trotting ( this takes a while ) without you holding it . this horse is very educational because tacking up ( saddling ) the horse is just like the real thing , and you can act like your horse and rider ( if you get one ) are riding', "". oh , and if you adore horses like me , you should definitely check out the breyer horses . they 're really realistic . i recommend this horse , tawny ! horse crazy"", 'breyer model horse paint your own horse activity kit not as much paint as i would have liked but over all a great project and fun for a breyer collector !']"
214,29,214_leak_leaks_leaking_leakage,"['leak', 'leaks', 'leaking', 'leakage', 'tray available', 'rim just', 'problems leaking', 'leak time', 'duct', 'rim']","['Leaky menstrual cups and solutions', '', '', '', '', '', '', '', '', '']","['i simply cleaned the pre filter and all was well . leaking ? this unit is molded as a single reservoir that sits upon a molded basin . unless you have a crack in your unit , it should not leak . the first time i put the reservoir down', 'making it prone to seam separation . two , another owner says vinyl repair patches , available at sporting goods stores , will stop the leaks . another user tried silicone gel , duct tape , and other approaches to no avail . i tried duct tape , but the', 'a longer lasting leak proof tray available ( the producers have no plans to make the tray available themselves . ) or , the disposables should at the very least should not leak . very poor produce i would have given it no stars if possible .']"
215,29,215_carrier_sherpa_pet carrier_kennel,"['carrier', 'sherpa', 'pet carrier', 'kennel', 'pet', 'carriers', 'petmate', 'cab', 'deluxe pet', 'outward']","['Pet Carriers and Kennels', '', '', '', '', '', '', '', '', '']","['sherpa original deluxe pet carrier , large , black i was so worried that this carrier would be too small for my 20lb beagle pug mix but it was perfect ! i saw a lot of bags at pet smart that said they would only hold up to 18lb and', 'original bag deluxe pet carrier color sherpa makes the best , most reliable carriers . would not buy any other . my persian cat travels safely and comfortably . original sherpa bag deluxe', 'sherpa 11721 delta pet carrier , medium , black great carrier . we are pleased with it . we have two ragdoll cats . we had car trouble and only had this carrier with . we were forced to put the two into this carrier . because of the size']"
216,29,216_toy_gag_chicken_fun toy,"['toy', 'gag', 'chicken', 'fun toy', 'toy worth', 'wonderful toy', 'text', 'toy recommend', 'toy toy', 'toy fun']","['Toy recommendations for kids', '', '', '', '', '', '', '', '', '']","[""radica girl tech friendchips i think it is cool because if you do n't have a cell phone like me it is like text messaging . so that is why i want this toy so me and my friend can text message ."", ""revell 05203 1 570 queen mary while writing this review , the website asks me to rate this 'toy' ... this model is by no means a toy ! it requires patience , precision , and skill ( that can be learned beforehand or during the model ) . if"", '18 "" squawkin rubber chicken novelty gag joke toy this chicken is simple enough . it \'s a plastic chicken . all it does however is shriek the most horrible sound of chicken death . i had no idea it would sound so bad until we got it . if']"
217,28,217_bees_bonsai_tree_brussel,"['bees', 'bonsai', 'tree', 'brussel', 'ants', 'juniper', 'reflections juniper', 'base time', 'juniper bonsai', 'tumbling']","['Bonsai trees and their care', '', '', '', '', '', '', '', '', '']","[""want the bees to fall out . it 's fun to see bees tumbling out of a tree . so , from the get go , this game has problems . secondly , it 's cheaply constructed . if you bump or accidentally shake it by pulling out a leaf"", ""brussel 's dt2101gmj green mound junpier bonsai i was skeptical buying a tree online , but am pleased to say that my bonsai arrived in good health . the shipping was excellent , and the tree came securely enveloped in a nest of packing peanuts . as for the tree"", 'zen reflections juniper bonsai this is my first bonsai tree it is really cool . i ordered it from 9greenbox , it arrived in 4 days . the tree was wrapped with plastic wrap placed snuggly in a box filled with packing foam . the tree itself came in great']"
218,28,218_eyes_angels_tear stain_eliminator,"['eyes', 'angels', 'tear stain', 'eliminator', 'tear', 'dogs cats', 'stain', 'stains', 'maltese', 'dogs']","[""Eye care for dogs and cats: Angels' Eyes tear stain eliminator"", '', '', '', '', '', '', '', '', '']","[""angels' eyes tear stain eliminator for dogs and cats this really does work ! i love that my dog , white maltese , does not have the tear stains on his pretty face . angels eyes for dogs 30 gram bottle"", ""angels' eyes tear stain eliminator for dogs and cats this product is wonderful . i have 3 maltese and without this their eyes are all stained ."", ""angels' eyes tear stain eliminator for dogs and cats angel eyes is working wonders for my bichon 's eyes and mouth area . he is white again ! beautiful !""]"
